drop table personne;
create table personne (pk serial primary key not null, nom varchar(30), prenom varchar(30), email varchar(50));

insert into personne (nom, prenom, email) values ('Nom', 'Prénom', 'e-mail@server.xx');
insert into personne (nom, prenom, email) values ('Lastname', 'Firstname', 'my-email.server.xx');
select * from personne;
 pk |   nom    |  prenom   |       email        
----+----------+-----------+--------------------
  1 | Nom      | Prénom    | e-mail@server.xx
  2 | Lastname | Firstname | my-email.server.xx
(2 rows)

delete from personne;
insert into personne (nom, prenom, email) values ('Nom', 'Prénom', 'e-mail@server.xx');
insert into personne (nom, prenom, email) values ('Lastname', 'Firstname', 'my-email.server.xx');
select * from personne;
 pk |   nom    |  prenom   |       email        
----+----------+-----------+--------------------
  3 | Nom      | Prénom    | e-mail@server.xx
  4 | Lastname | Firstname | my-email.server.xx
(2 rows)

update personne set email = 'my-email@server.xx' where pk = 4;
select * from personne;
 pk |   nom    |  prenom   |       email        
----+----------+-----------+--------------------
  3 | Nom      | Prénom    | e-mail@server.xx
  4 | Lastname | Firstname | my-email@server.xx
(2 rows)

alter table personne add column fonction varchar(40);
update personne set fonction = 'Fonction' where nom = 'Nom';
update personne set fonction = 'Function' where prenom = 'Firstname';
select * from personne;
 pk |   nom    |  prenom   |       email        | fonction 
----+----------+-----------+--------------------+----------
  3 | Nom      | Prénom    | e-mail@server.xx   | Fonction
  4 | Lastname | Firstname | my-email@server.xx | Function
(2 rows)



CREATE TABLE users(
    userid SERIAL PRIMARY KEY,
    username VARCHAR(50) UNIQUE NOT NULL,
    userpassword VARCHAR(255) NOT NULL,
    useremail VARCHAR(255) UNIQUE NOT NULL,
    userdescription VARCHAR(255)

CREATE INDEX username_index ON users(username);
CREATE INDEX useremail_index ON users(useremail);

select * from users;
 userid | username | userpassword | useremail | userdescription 
--------+----------+--------------+-----------+-----------------
(0 rows)

create table role (roleid serial primary key, role varchar(50) unique not null);

select * from role;
 roleid | role 
--------+------
(0 rows)

create table roleuser (pk serial primary key , roleid integer, userid integer, foreign key(roleid) references role(roleid), foreign key(userid) references users(userid));
select * from roleuser;
 pk | roleid | userid 
----+--------+--------
(0 rows)

insert into role (role) values ('ADMIN');
insert into role (role) values ('USER');

select * from role;
 roleid | role  
--------+-------
      1 | ADMIN
      2 | USER
(2 rows)

select * from users;
 userid | username | userpassword | useremail | userdescription 
--------+----------+--------------+-----------+-----------------
(0 rows)
